{
  "id": "starter-minion-witch",
  "name": "Starter Minion / Companion Witch",
  "summary": "A minion-oriented Witch starter where summoned bodies absorb pressure and deal damage while the player learns enemy attacks. Beginner-friendly, but minion scaling and Spirit reservation need attention.",
  "who_should_play": [
    "New players who want extra bodies between them and danger while learning.",
    "Players who prefer commanding minions over precise aiming.",
    "Players who can tolerate slightly more complex scaling (Spirit, minion stats)."
  ],
  "patch_version": "0.5.2 Early Access",
  "last_reviewed": "2026-06-16",
  "status": "published",
  "review_state": "needs_review",
  "review_notes": "Last researched for 0.5.2 and not retested in game. The site now tracks official patch 0.5.4c, so this card remains published only as an explicitly stale decision aid and needs a full mechanics and in-game review before it can be called current.",
  "known_broken_by_patch": [],
  "source": {
    "type": "self-authored",
    "url": "",
    "notes": "Authored from research cards 03-09; not a copied creator build."
  },
  "source_links": [
    {
      "label": "Official PoE2 0.5.4c patch notes (review trigger)",
      "url": "https://www.pathofexile.com/forum/view-thread/3985152"
    },
    {
      "label": "Official PoE2 patch notes forum",
      "url": "https://www.pathofexile.com/forum/view-forum/2212"
    },
    {
      "label": "Gem ids: Path of Building Community PoE2 (community data)",
      "url": "https://github.com/PathOfBuildingCommunity/PathOfBuilding-PoE2"
    }
  ],
  "trust": {
    "score": 3,
    "proof": [
      "research-card",
      "manual-review"
    ],
    "source_type": "self-authored",
    "verified_at": "2026-06-16",
    "budget_floor": "low",
    "controller_friendly": "unknown",
    "hardcore_viable": "unknown",
    "ssf_viable": "yes",
    "trade_viable": "yes",
    "failure_modes": [
      "Minions die repeatedly if their survivability and your Spirit setup are neglected.",
      "Minion scaling is patch-sensitive; a balance change can shift power noticeably.",
      "Player can become too passive and forget personal defenses."
    ],
    "risks": [
      "not-in-game-tested",
      "patch-sensitive",
      "minion-balance-sensitive"
    ]
  },
  "class": "Witch",
  "ascendancy": "Necromancer",
  "budget": "low",
  "complexity": "medium",
  "gear_dependency": "medium",
  "content_fit": {
    "campaign": "recommended",
    "early_maps": "viable",
    "pinnacle": "unknown"
  },
  "uses_spirit": true,
  "skills": [
    {
      "name": "Raise Zombie",
      "role": "main",
      "gem_id": "Metadata/Items/Gems/SkillGemRaiseZombie",
      "supports": [
        {
          "name": "Minion Pact I",
          "gem_id": "Metadata/Items/Gem/SupportGemMinionPact",
          "note": "Core minion damage scaling; Intelligence-weighted."
        },
        {
          "name": "Last Gasp",
          "gem_id": "Metadata/Items/Gem/SupportGemLastGasp",
          "note": "Helps minions survive longer between resummons."
        }
      ],
      "note": "Your main army skill. Keep zombie count stable before chasing luxury damage supports."
    },
    {
      "name": "Frost Wall",
      "role": "utility",
      "gem_id": "Metadata/Items/Gems/SkillGemFrostWall",
      "supports": [],
      "note": "Blocks enemy paths while minions fight \u2014 cheap defensive utility that does not add Spirit reservation."
    },
    {
      "name": "Blink",
      "role": "movement",
      "gem_id": "Metadata/Items/Gem/SkillGemBlink",
      "supports": [],
      "note": "Short-range escape. Minions do not make you invincible \u2014 you still dodge."
    }
  ],
  "passive_milestones": [
    {
      "stage": "Early campaign",
      "goal": "Take minion offence and minion defence clusters near the Witch start.",
      "node_ids": [
        "minion_offence1",
        "minion_offence3",
        "minion_defence1"
      ]
    },
    {
      "stage": "Mid campaign",
      "goal": "Pick up more minion survival and personal life nodes.",
      "node_ids": [
        "minion_defence2",
        "minion_offence4",
        "mastery_life131"
      ]
    },
    {
      "stage": "Late campaign",
      "goal": "Balance minion damage with your own resistances before pure damage.",
      "node_ids": [
        "minion_offence5",
        "minion_defence3",
        "mastery_life132"
      ]
    }
  ],
  "attributes": {
    "required": {
      "str": 0,
      "dex": 0,
      "int": 100
    },
    "planned": {
      "str": 0,
      "dex": 0,
      "int": 120
    },
    "deficit_policy": "warn",
    "notes": [
      "Raise Zombie and linked supports are Intelligence-weighted (100 Int at level 1 from community gem data).",
      "Keep Intelligence above your highest gem requirement; the amulet often supplies the buffer."
    ]
  },
  "spirit_budget": {
    "required": 0,
    "planned": 0,
    "sources": [
      {
        "name": "Weapon (sceptre with Spirit)",
        "amount": 0
      },
      {
        "name": "Amulet (Spirit roll)",
        "amount": 0
      },
      {
        "name": "Body armour (Spirit roll)",
        "amount": 0
      }
    ],
    "notes": [
      "Minions reserve Spirit. Exact reservation per zombie depends on gem level and is not in our community extract \u2014 enter your in-game total in the attribute checker.",
      "Do not add persistent minions or aura supports until you know your Spirit capacity.",
      "Gear that grants Spirit is part of your reservation budget; swapping it can desummon minions."
    ]
  },
  "gear_slots": {
    "weapon": {
      "base": "Sceptre or minion-supporting spell weapon",
      "priority": [
        "+minion gem levels or minion damage",
        "Spirit",
        "attributes"
      ],
      "required_affixes": [
        "+minion levels or minion damage"
      ],
      "good_affixes": [
        "Spirit",
        "+intelligence"
      ],
      "luxury_affixes": [
        "high-tier minion damage + Spirit combo"
      ],
      "budget_compromise": "Cheap sceptre with minion damage or Spirit is enough for campaign.",
      "campaign_target": "Any sceptre with minion damage or +levels",
      "early_maps_target": "Spirit source plus minion damage",
      "red_maps_target": "Strong minion levels with Spirit for extra minions or supports",
      "budget_note": "Spirit or +minion levels beats raw spell damage for this build."
    },
    "body_armour": {
      "base": "Energy-shield or hybrid base that meets attribute requirements",
      "priority": [
        "life or energy shield",
        "elemental resistances",
        "Spirit if available"
      ],
      "required_affixes": [
        "life or energy shield",
        "one elemental resistance"
      ],
      "good_affixes": [
        "second resistance",
        "Spirit"
      ],
      "luxury_affixes": [
        "high life + dual res + Spirit"
      ],
      "budget_compromise": "Plain rare with life and one resistance.",
      "campaign_target": "Life/ES with two resistances",
      "early_maps_target": "Fill resistance gaps; Spirit is a bonus",
      "red_maps_target": "High defensive rolls before luxury minion modifiers",
      "budget_note": "Your own survivability matters; do not hide behind minions alone."
    },
    "helmet": {
      "base": "Any base meeting attribute requirements",
      "priority": [
        "life or energy shield",
        "resistances",
        "minion modifiers if available"
      ],
      "required_affixes": [
        "life or energy shield",
        "one resistance"
      ],
      "good_affixes": [
        "minion life or damage",
        "second resistance"
      ],
      "luxury_affixes": [
        "minion modifiers with high life"
      ],
      "budget_compromise": "Life + one resistance rare.",
      "campaign_target": "Life + two resistances",
      "early_maps_target": "Minion survivability modifiers if affordable",
      "red_maps_target": "Minion life/damage with capped resists",
      "budget_note": "Plain rare with life and resists is enough for campaign."
    },
    "gloves": {
      "base": "Any base meeting attribute requirements",
      "priority": [
        "resistances",
        "life",
        "minion or cast modifiers if affordable"
      ],
      "required_affixes": [
        "elemental resistance"
      ],
      "good_affixes": [
        "life",
        "minion damage"
      ],
      "luxury_affixes": [
        "attack/cast speed for personal skills"
      ],
      "budget_compromise": "Resistance filler slot.",
      "campaign_target": "Life + resistances",
      "early_maps_target": "Minion damage if resistances are capped",
      "red_maps_target": "Minion damage + life with capped resists",
      "budget_note": "Fill resistance gaps cheaply here."
    },
    "boots": {
      "base": "Any defensive base that meets attribute requirements",
      "priority": [
        "movement speed",
        "life or energy shield",
        "resistances"
      ],
      "required_affixes": [
        "movement speed"
      ],
      "good_affixes": [
        "life or energy shield",
        "one resistance"
      ],
      "luxury_affixes": [
        "high movement + dual res"
      ],
      "budget_compromise": "Movement speed is non-negotiable for safety.",
      "campaign_target": "Movement speed + life + one res",
      "early_maps_target": "Movement speed with two resistances",
      "red_maps_target": "High movement with capped resists",
      "budget_note": "Movement speed keeps you out of danger while minions fight."
    },
    "belt": {
      "base": "Any belt base",
      "priority": [
        "life",
        "resistances",
        "flask or charm utility"
      ],
      "required_affixes": [
        "life",
        "one resistance"
      ],
      "good_affixes": [
        "second resistance",
        "flask duration"
      ],
      "luxury_affixes": [
        "high life triple resistance"
      ],